{
  "accepted": true,
  "schema_version": "1.0",
  "supervisor_checks": {
    "connect": "denied",
    "descriptor_passing": "denied",
    "exec": "denied",
    "file_open": "denied",
    "io_uring": "denied",
    "ipv4_tcp": "denied",
    "ipv4_udp": "denied",
    "ipv6_tcp": "denied",
    "ipv6_udp": "denied",
    "namespace": "denied",
    "unix_socket": "denied"
  },
  "trace_id": "0123456789abcdef0123456789abcdef",
  "worker_checks": {
    "connect": "denied",
    "descriptor_passing": "denied",
    "exec": "denied",
    "file_open": "denied",
    "io_uring": "denied",
    "ipv4_tcp": "denied",
    "ipv4_udp": "denied",
    "ipv6_tcp": "denied",
    "ipv6_udp": "denied",
    "namespace": "denied",
    "unix_socket": "denied"
  }
}
